{
  "kind": "trace_integrity_checkpoint",
  "schema_version": "trace-integrity-checkpoint:v1",
  "mode": "local_tamper_evidence",
  "authenticity_claimed": false,
  "hash_algorithm": "sha256",
  "trace_file": "ST-ENT-GOVERNANCE.jsonl",
  "legacy_prefix": {
    "line_count": 0,
    "byte_length": 0,
    "sha256": "e3b0c44298fc1c149afbf4c8996fb92427ae41e4649b934ca495991b7852b855"
  },
  "new_writes": {
    "count": 10,
    "first_sequence": 1,
    "last_sequence": 10,
    "last_event_hash": "b95299ad2b79ce5edd2481bd0974fae91cb6cc045d0d33231440635cd4060cc4",
    "rolling_hash": "746966df5fd41818c3a0b6c748bd458c77cb3abd8ca5feee456b6c77d44b05ff"
  },
  "committed_offset": 22414,
  "updated_at": "2026-07-18T20:38:11.004Z",
  "checkpoint_hash": "bc43edafd04afd306eec035a6753cddae491beb7635b9025e9fbed07c6ab611a"
}
