{
  "kind": "trace_integrity_checkpoint",
  "schema_version": "trace-integrity-checkpoint:v1",
  "mode": "local_tamper_evidence",
  "authenticity_claimed": false,
  "hash_algorithm": "sha256",
  "trace_file": "ST-ENT-RELEASE-R1.jsonl",
  "legacy_prefix": {
    "line_count": 0,
    "byte_length": 0,
    "sha256": "e3b0c44298fc1c149afbf4c8996fb92427ae41e4649b934ca495991b7852b855"
  },
  "new_writes": {
    "count": 44,
    "first_sequence": 1,
    "last_sequence": 44,
    "last_event_hash": "8eac1cb06c0125d34de7a2474b8eea460f308075ab46bb9d882194c402871792",
    "rolling_hash": "a2a97277a84d228655bda6ba06e2295441d93fe8121b31d3eb099800ed7e53c8"
  },
  "committed_offset": 96544,
  "updated_at": "2026-07-19T04:00:49.953Z",
  "checkpoint_hash": "87b2e068b3fbd39cd419e99490f3c8ee55e99cbacc7485eab13a6460050133a3"
}
