{
  "kind": "trace_integrity_checkpoint",
  "schema_version": "trace-integrity-checkpoint:v1",
  "mode": "local_tamper_evidence",
  "authenticity_claimed": false,
  "hash_algorithm": "sha256",
  "trace_file": "ST-NOVICE-PLUGIN-JOURNEY.jsonl",
  "legacy_prefix": {
    "line_count": 0,
    "byte_length": 0,
    "sha256": "e3b0c44298fc1c149afbf4c8996fb92427ae41e4649b934ca495991b7852b855"
  },
  "new_writes": {
    "count": 25,
    "first_sequence": 1,
    "last_sequence": 25,
    "last_event_hash": "0aa68e45d258b98bd64f298392ed8bd8de7476e6b3a6aee76585726e4b0f58df",
    "rolling_hash": "ffea5430e2ae2b0f58f3f91a3867b1fe1b482fa065666020b6b88913f185ecbf"
  },
  "committed_offset": 58682,
  "updated_at": "2026-07-26T18:48:34.383Z",
  "checkpoint_hash": "8072c23d132437338f3f1fe6f6351315f6ae0efe32891dabdfbb45b8d4648e3d"
}
