{
  "kind": "trace_integrity_checkpoint",
  "schema_version": "trace-integrity-checkpoint:v1",
  "mode": "local_tamper_evidence",
  "authenticity_claimed": false,
  "hash_algorithm": "sha256",
  "trace_file": "ST-ENT-LOCAL-RELEASE-R1.jsonl",
  "legacy_prefix": {
    "line_count": 0,
    "byte_length": 0,
    "sha256": "e3b0c44298fc1c149afbf4c8996fb92427ae41e4649b934ca495991b7852b855"
  },
  "new_writes": {
    "count": 4,
    "first_sequence": 1,
    "last_sequence": 4,
    "last_event_hash": "870666a304f84d7df3ae75e51c68146fbd136179e63811090bdfb2c8fdab3a10",
    "rolling_hash": "f33f04db8b32dedad6dd08e56a49816221cc49a049c9e6ea6c290f0aeb19c516"
  },
  "committed_offset": 9291,
  "updated_at": "2026-07-19T03:50:59.914Z",
  "checkpoint_hash": "ea1e4561947f392c7929f1918357aa9aad6f7281718c0ba3f7b8ecc0757175ef"
}
