{
  "kind": "trace_integrity_checkpoint",
  "schema_version": "trace-integrity-checkpoint:v1",
  "mode": "local_tamper_evidence",
  "authenticity_claimed": false,
  "hash_algorithm": "sha256",
  "trace_file": "ST-CI-SUBPROCESS-POLICY-R3.jsonl",
  "legacy_prefix": {
    "line_count": 0,
    "byte_length": 0,
    "sha256": "e3b0c44298fc1c149afbf4c8996fb92427ae41e4649b934ca495991b7852b855"
  },
  "new_writes": {
    "count": 13,
    "first_sequence": 1,
    "last_sequence": 13,
    "last_event_hash": "9ff4cb8b4ac1540b31b4daa1a5bce618a86a0730f121c759f5c42624e33832e9",
    "rolling_hash": "84d0cf2c58b14fd481d03e82a89b8c4d5770dda0c0fc2eea7c249b4d5b58c4d3"
  },
  "committed_offset": 32649,
  "updated_at": "2026-07-30T00:47:20.359Z",
  "checkpoint_hash": "50d46ae23666425d6c0a3f55de7686ac24b23bab484f7d58a9ebadb9bf4ae9e2"
}
