{
  "kind": "trace_integrity_checkpoint",
  "schema_version": "trace-integrity-checkpoint:v1",
  "mode": "local_tamper_evidence",
  "authenticity_claimed": false,
  "hash_algorithm": "sha256",
  "trace_file": "ST-LOCAL-RUNTIME-HARDENING-R1.jsonl",
  "legacy_prefix": {
    "line_count": 0,
    "byte_length": 0,
    "sha256": "e3b0c44298fc1c149afbf4c8996fb92427ae41e4649b934ca495991b7852b855"
  },
  "new_writes": {
    "count": 22,
    "first_sequence": 1,
    "last_sequence": 22,
    "last_event_hash": "a1549bf4bf483f6a06740e65e8580924f6940152fb602bdb503d942ed4ed6d24",
    "rolling_hash": "e93856920987f652030e0721e6e19a7a557e62d262e0d01853436507ef9fe955"
  },
  "committed_offset": 50492,
  "updated_at": "2026-07-29T22:09:42.913Z",
  "checkpoint_hash": "8d35a6d50e238ab96cf3b63fc67ac6971bc4cbaa7a857ae47e5a25fb7b960dec"
}
