{
  "kind": "trace_integrity_checkpoint",
  "schema_version": "trace-integrity-checkpoint:v1",
  "mode": "local_tamper_evidence",
  "authenticity_claimed": false,
  "hash_algorithm": "sha256",
  "trace_file": "ST-ENT-OBSERVABILITY.jsonl",
  "legacy_prefix": {
    "line_count": 12,
    "byte_length": 12034,
    "sha256": "e806687a2012e09267f7a15966c7bf843dd85219e723dff97a8da02bab5ce80f"
  },
  "new_writes": {
    "count": 24,
    "first_sequence": 1,
    "last_sequence": 24,
    "last_event_hash": "a89dddbe1f9c7542f52cbc37e622c32430ce9049fc637727a33e72d3f3fc390b",
    "rolling_hash": "71e33aaa99a3bde61be0fcb33067afc68a0ce1f6de8a7ec1af03f1ff15f86635"
  },
  "committed_offset": 71909,
  "updated_at": "2026-07-18T15:47:17.141Z",
  "checkpoint_hash": "f492b3144e82d3b86fafe168a90978c7cc51afba533cfa461863b2d8a20b1b49"
}
